id;name;yearpublished;minplayers;maxplayers;playingtime;minplaytime;maxplaytime;averageweight;rank;average;bayesaverage;owning;domain;category;mechanic;image;desc
2651;Power Grid;2004;2;6;120;120;120;3,25;62;7,81;7,69;82202;Strategy Games;Economic, Industry / Manufacturing;Auction / Bidding, Auction: Turn Order Until Pass, Catch the Leader, Income, Market, Network and Route Building, Turn Order: Stat-Based, Variable Set-up;C:\Users\Tomson\Documents\BGG1tool\img\img002651.jpg;Power Grid is the updated release of the Friedemann Friese crayon game Funkenschlag. It removes the crayon aspect from network building in the original edition, while retaining the fluctuating commodities market like Crude: The Oil Game and an auction round intensity reminiscent of The Princes of Florence.The objective of Power Grid is to supply the most cities with power when someone's network gains a predetermined size.  In this new edition, players mark pre-existing routes between cities for connection, and then bid against each other to purchase the power plants that they use to power their cities.However, as plants are purchased, newer, more efficient plants become available, so by merely purchasing, you're potentially allowing others access to superior equipment.Additionally, players must acquire the raw materials (coal, oil, garbage, and uranium) needed to power said plants (except for the 'renewable' windfarm/ solar plants, which require no fuel), making it a constant struggle to upgrade your plants for maximum efficiency while still retaining enough wealth to quickly expand your network to get the cheapest routes.? Power Grid FAQ - Please read this before posting a rules question!  Many questions are asked over and over in the forums... If you have a question about a specific expansion, please check the rules forum or FAQ for that particular expansion.
276025;Maracaibo;2019;1;4;120;30;120;3,92;63;7,99;7,68;23427;Strategy Games;Economic, Exploration, Nautical, Pirates;Contracts, End Game Bonuses, Events, Hand Management, Income, Movement Points, Multi-Use Cards, Narrative Choice / Paragraph, Point to Point Movement, Scenario / Mission / Campaign Game, Set Collection, Solo / Solitaire Game, Stock Holding, Tech Trees / Tech Tracks, Track Movement, Variable Set-up;C:\Users\Tomson\Documents\BGG1tool\img\img276025.jpg;"Maracaibo, a strategy game for 1-4 players by Alexander Pfister, is set in the Caribbean during the 17th century. The players try to increase their influence in three nations in four rounds with a play time of 40 minutes per player.The players sail on a round course through the Caribbean, e.g., you have city tiles where you are able to perform various&nbsp;actions or deliver goods to. One special feature is an implemented quest mode over more and various tiles, which tells the player, who chase after it, a little story.As a player, you move with your ship around the course, managing it by using cards like in other games from Alexander Pfister.NOTE: The Spanish and Portuguese editions of Maracaibo contain La Armada mini-expansion packaged inside the base game's box."
244521;The Quacks of Quedlinburg;2018;2;4;45;45;45;1,94;64;7,82;7,68;82954;Family Games;Medieval;Catch the Leader, Deck, Bag, and Pool Building, Delayed Purchase, Dice Rolling, Events, Open Drafting, Push Your Luck, Simultaneous Action Selection, Variable Set-up;C:\Users\Tomson\Documents\BGG1tool\img\img244521.png;In The Quacks of Quedlinburg, players are charlatans - or quack doctors - each making their own secret brew by adding ingredients one at a time. Take care with what you add, though, for a pinch too much of this or that will spoil the whole mixture!Each player has their own bag of ingredient chips. During each round, they simultaneously draw chips from their bags and add them to their pots. The higher the face value of the drawn chip, the further it is placed in the pot's swirling pattern, increasing how much the potion will be worth. Push your luck as far as you can, but if you add too many cherry bombs, your pot will explode!At the end of each round, players gain victory points and coins to spend on new ingredients, depending on how well they managed to fill up their pots. But players whose pots have exploded must choose points or coins - not both! The player with the most victory points at the end of nine rounds wins the game.
216132;Clans of Caledonia;2017;1;4;120;30;120;3,46;65;7,94;7,68;22179;Strategy Games;Economic, Farming;Commodity Speculation, Contracts, Income, Market, Modular Board, Network and Route Building, Solo / Solitaire Game, Turn Order: Pass Order, Variable Player Powers;C:\Users\Tomson\Documents\BGG1tool\img\img216132.png;Clans of Caledonia is a mid-to-heavy economic game set in 19th-century Scotland. At this time, Scotland made the transition from an agricultural to an industrialized country that heavily relied on trade and export. In the following years, food production increased significantly to feed the population growth. Linen was increasingly substituted by the cheaper cotton and raising sheep was given high importance. More and more distilleries were founded and whisky became the premium alcoholic beverage in Europe.Players represent historic clans with unique abilities and compete to produce, trade and export agricultural goods and of course whisky!The game ends after five rounds. Each round consists of the three phases:     Players' turns     Production phase     Round scoring1. Players take turns and do one of eight possible actions, from building, to upgrading, trading and exporting. When players run out of money, they pass and collect a passing bonus.2. In the production phase, each player collects basic resources, refined goods and cash from their production units built on the game map. Each production unit built makes income visible on the player mat. Refined goods require the respective basic resource.3. Players receive VPs depending on the scoring tile of the current round.The game comes with eight different clans, a modular board with 16 configurations, eight port bonuses and eight round scoring tiles.
35677;Le Havre;2008;1;5;150;30;150;3,71;66;7,85;7,67;37898;Strategy Games;City Building, Economic, Industry / Manufacturing, Nautical;Automatic Resource Growth, End Game Bonuses, Increase Value of Unchosen Resources, Loans, Ownership, Solo / Solitaire Game, Worker Placement;C:\Users\Tomson\Documents\BGG1tool\img\img035677.jpg;"In Le Havre, a player's turn consists of two parts: First, distribute newly supplied goods onto the offer spaces; then take an action. As an action, players may choose either to take all goods of one type from an offer space or to use one of the available buildings. Building actions allow players to upgrade goods, sell them or use them to build their own buildings and ships. Buildings are both an investment opportunity and a revenue stream, as players must pay an entry fee to use buildings that they do not own. Ships, on the other hand, are primarily used to provide the food that is needed to feed the workers.After every seven turns, the round ends: players' cattle and grain may multiply through a Harvest, and players must feed their workers. After a fixed number of rounds, each player may carry out one final action, and then the game ends. Players add the value of their buildings and ships to their cash reserves. The player who has amassed the largest fortune is the winner."
266810;Paladins of the West Kingdom;2019;1;4;120;90;120;3,72;67;7,97;7,67;30180;Strategy Games;Medieval;End Game Bonuses, Market, Open Drafting, Solo / Solitaire Game, Worker Placement, Worker Placement, Different Worker Types;C:\Users\Tomson\Documents\BGG1tool\img\img266810.png;Paladins of the West Kingdom is set at a turbulent time of West Francia's story, circa 900 AD. Despite recent efforts to develop the city, outlying townships are still under threat from outsiders. Saracens scout the borders, while Vikings plunder wealth and livestock. Even the Byzantines from the east have shown their darker side. As noble men and women, players must gather workers from the city to defend against enemies, build fortifications and spread faith throughout the land. Fortunately you are not alone. In his great wisdom, the King has sent his finest knights to help aid in our efforts. So ready the horses and sharpen the swords. The Paladins are approaching.The aim of Paladins of the West Kingdom is to be the player with the most victory points (VP) at game's end. Points are gained by building outposts and fortifications, commissioning monks and confronting outsiders. Each round, players will enlist the help of a specific Paladin and gather workers to carry out tasks. As the game progresses, players will slowly increase their faith, strength and influence. Not only will these affect their final score, but they will also determine the significance of their actions. The game is concluded at the end of the seventh round.-description from the publisher
164153;Star Wars: Imperial Assault;2014;2;5;120;60;120;3,3;68;7,96;7,67;43119;Thematic Games;Adventure, Exploration, Fighting, Miniatures, Movies / TV / Radio theme, Science Fiction, Wargame;Dice Rolling, Die Icon Resolution, Grid Movement, Line of Sight, Modular Board, Role Playing, Scenario / Mission / Campaign Game, Solo / Solitaire Game, Square Grid, Team-Based Game, Variable Player Powers;C:\Users\Tomson\Documents\BGG1tool\img\img164153.jpg;Star Wars: Imperial Assault is a strategy board game of tactical combat and missions for two to five players, offering two distinct games of battle and adventure in the Star Wars universe!Imperial Assault puts you in the midst of the Galactic Civil War between the Rebel Alliance and the Galactic Empire after the destruction of the Death Star over Yavin 4. In this game, you and your friends can participate in two separate games. The campaign game pits the limitless troops and resources of the Galactic Empire against a crack team of elite Rebel operatives as they strive to break the Empire's hold on the galaxy, while the skirmish game invites you and a friend to muster strike teams and battle head-to-head over conflicting objectives.In the campaign game, Imperial Assault invites you to play through a cinematic tale set in the Star Wars universe. One player commands the seemingly limitless armies of the Galactic Empire, threatening to extinguish the flame of the Rebellion forever. Up to four other players become heroes of the Rebel Alliance, engaging in covert operations to undermine the Empire's schemes. Over the course of the campaign, both the Imperial player and the Rebel heroes gain new experience and skills, allowing characters to evolve as the story unfolds.Imperial Assault offers a different game experience in the skirmish game. In skirmish missions, you and a friend compete in head-to-head, tactical combat. You'll gather your own strike force of Imperials, Rebels, and Mercenaries and build a deck of command cards to gain an unexpected advantage in the heat of battle. Whether you recover lost holocrons or battle to defeat a raiding party, you'll find danger and tactical choices in every skirmish.As an additional benefit, the Luke Skywalker Ally Pack and the Darth Vader Villain Pack are included within the Imperial Assault Core Set. These figure packs offer sculpted plastic figures alongside additional campaign and skirmish missions that highlight both Luke Skywalker and Darth Vader within Imperial Assault.With these Imperial Assault and other Figure Packs, you'll find even more missions that allow your heroes to fight alongside iconic characters from the Star Wars saga. Boxed expansions add more heroes, imperial and mercenary groups, and totally new campaigns (see IA Community Wiki for a list), and the free Star Wars: Imperial Assault - Legends of the Alliance app provides you with additional content to play in solo or co-op mode.
383179;Age of Innovation;2023;1;5;200;40;200;4,26;69;8,61;7,66;7934;Strategy Games;Civilization, Fantasy, Territory Building;Contracts, End Game Bonuses, Hexagon Grid, Income, Modular Board, Network and Route Building, Turn Order: Pass Order, Variable Player Powers, Variable Set-up, Victory Points as a Resource;C:\Users\Tomson\Documents\BGG1tool\img\img383179.jpg;Age of Innovation is a standalone game set in the world of Terra Mystica.Twelve factions, each with unique characteristics, populate this world of varying terrains. Here you will compete to erect buildings and merge them into cities. Each game allows you to create new combinations of factions, homelands, and abilities so that each game isn't the same as another.You control one of these factions and will terraform the game map's terrain into your homelands where you can erect your buildings. Proximity to other factions may limit your expansion, but it also gains you significant advantages in the game. This tension adds to the appeal of the Terra Mystica series.Upgrade your buildings to gain valuable resources such as tools, scholars, money, and power. Build schools to advance in different sciences and collect books, which you can use to make innovations. Build your palace to gain a powerful new ability or build workshops, guilds, and universities to complete your culture.-description from the publisher
124742;Android: Netrunner;2012;2;2;45;45;45;3,41;70;7,89;7,66;46288;Customizable Games;Bluffing, Card Game, Collectible Components, Science Fiction;Action Points, Deck Construction, Hand Management, Race, Secret Unit Deployment, Take That, Variable Player Powers;C:\Users\Tomson\Documents\BGG1tool\img\img124742.jpg;"Welcome to New Angeles, home of the Beanstalk. From our branch offices in this monument of human achievement, NBN proudly broadcasts all your favorite media programming. We offer fully comprehensive streaming in music and threedee, news and sitcoms, classic movies and sensies. We cover it all. Ours is a brave new age, and as humanity hurtles into space and the future with an astonishing series of new advances every day, NBN and our affiliates are keeping pace, bringing you all the vid that's fit to view.Android: Netrunner is an asymmetrical Living Card Game for two players. Set in the cyberpunk future of Android and Infiltration, the game pits a megacorporation and its massive resources against the subversive talents of lone runners.Corporations seek to score agendas by advancing them. Doing so takes time and credits. To buy the time and earn the credits they need, they must secure their servers and data forts with ""ice"". These security programs come in different varieties, from simple barriers, to code gates and aggressive sentries. They serve as the corporation's virtual eyes, ears, and machine guns on the sprawling information superhighways of the network.In turn, runners need to spend their time and credits acquiring a sufficient wealth of resources, purchasing the necessary hardware, and developing suitably powerful ice-breaker programs to hack past corporate security measures. Their jobs are always a little desperate, driven by tight timelines, and shrouded in mystery. When a runner jacks-in and starts a run at a corporate server, he risks having his best programs trashed or being caught by a trace program and left vulnerable to corporate countermeasures. It's not uncommon for an unprepared runner to fail to bypass a nasty sentry and suffer massive brain damage as a result. Even if a runner gets through a data fort's defenses, there's no telling what it holds. Sometimes, the runner finds something of value. Sometimes, the best he can do is work to trash whatever the corporation was developing.The first player to seven points wins the game, but not likely before he suffers some brain damage or bad publicity.The Revised Core Set for Android: Netrunner released in late 2017 includes cards from the original Core Set released in 2012 as well as cards from the Genesis Cycle and Spin Cycle series of Data Packs. While the cards in this set have been released previously, the art on some of them is new."
209010;Mechs vs. Minions;2016;2;4;120;60;120;2,45;71;7,96;7,65;24467;Strategy Games, Thematic Games;Fantasy, Fighting, Miniatures, Video Game Theme;Action Queue, Bias, Cooperative Game, Dice Rolling, Modular Board, Open Drafting, Programmed Movement, Role Playing, Slide / Push, Variable Player Powers;C:\Users\Tomson\Documents\BGG1tool\img\img209010.jpg;Mechs vs. Minions is a cooperative tabletop campaign for 2-4 players. Set in the world of Runeterra, players take on the roles of four intrepid Yordles: Corki, Tristana, Heimerdinger, and Ziggs, who must join forces and pilot their newly-crafted mechs against an army of marauding minions. With modular boards, programmatic command lines, and a story-driven campaign, each mission will be unique, putting your teamwork, programming, and piloting skills to the test.There are ten missions in total, and each individual mission will take about 60-90 minutes.
284083;The Crew: The Quest for Planet Nine;2019;2;5;20;20;20;1,96;72;7,79;7,65;83922;Family Games;Card Game, Science Fiction, Space Exploration;Communication Limits, Cooperative Game, Hand Management, Scenario / Mission / Campaign Game, Trick-taking;C:\Users\Tomson\Documents\BGG1tool\img\img284083.jpg;In the co-operative trick-taking game The Crew: The Quest for Planet Nine, the players set out as astronauts on an uncertain space adventure. What are the rumors regarding the unknown planet about? The eventful journey through space extends over 50 exciting missions. But this game can only be defeated by meeting common individual tasks of each player. In order to meet the varied challenges communication is essential in the team. But this is more difficult than expected in space.With each mission the game becomes more difficult. After each mission the game can be paused and continued later. During each mission it is not the number of tricks but the right tricks at the right time that count.The team completes a mission only if every single player is successful in fulfilling their tasks.The game comes with 50 missions, with three additional missions published in spielbox 2/2020.
55690;Kingdom Death: Monster;2015;1;4;180;60;180;4,27;73;8,49;7,64;13219;Thematic Games;Adventure, Fantasy, Fighting, Horror, Mature / Adult, Miniatures, Mythology;Cooperative Game, Critical Hits and Failures, Dice Rolling, Grid Movement, Role Playing, Scenario / Mission / Campaign Game, Solo / Solitaire Game, Storytelling;C:\Users\Tomson\Documents\BGG1tool\img\img055690.jpg;"Kingdom Death: Monster is a fully cooperative tabletop hobby game experience.  Set in a unique nightmarish world devoid of most natural resources, you control a settlement at the dawn of its existence. Fight monsters, craft weapons and gear, and develop your settlement to ensure your survival from generation to generation.Campaign SystemEmbark alone or with up to 3 friends (5 with game variant) on a 5-30-lantern-year campaign, with each year consisting of a cycle of hunt, showdown, and settlement phases. The settlement phase is an intricate civilization building game in which you spend very limited resources to build buildings, research new technologies, train your warriors, and set up your strategy for survival.  During the hunt, you'll encounter a series of stories in a ""choose your own adventure"" style journey through various events and encounters.  Finally, when you meet the monster you're pursuing, you'll engage it in an a massive arena-style battle where only one party is going to survive.  If your party lives, you'll be able to bring the spoils back home to use in expanding your settlement.Monster AI SystemEach of the 7 monsters included are controlled by their own pair of decks that scale to 3 levels of difficulty (except for the final encounter, which has only 1 level and it's HARD!). Every encounter, even with the same monster, is highly variable and no two showdowns will resolve the same way. Players will have to plan their gear and keep their minds sharp to prevail.Gear SystemIn Kingdom Death: Monster, survivors will craft gear from resources earned from defeating monsters or found on their hunt. Each survivor has a 3x3 gear grid. Selection and arrangement of your gear cards is critical, as many provided bonuses and activate special rules when aligned correctly.Story Event System40+ Story Events plus over 100 hunt encounters will shape and guide your campaign. Story Events detail important evolutions in your civilization, introduce new monsters, and provide rich detail for your campaign.  Some will trigger automatically as you progress through the campaign, but most will be entirely based on choices players make.Story Events cover everything from setting up and fighting a monster to key events that happen within the overall story. Some are triggered directly from the timeline and others from choices you make in game."
200680;Agricola (Revised Edition);2016;1;4;120;30;120;3,45;74;7,95;7,64;26168;Strategy Games;Animals, Economic, Farming;Enclosure, Hand Management, Worker Placement, Advantage Token, Automatic Resource Growth, Closed Drafting, Increase Value of Unchosen Resources, Solo / Solitaire Game, Team-Based Game, Turn Order: Claim Action, Variable Player Powers;C:\Users\Tomson\Documents\BGG1tool\img\img200680.jpg;"Updated and streamlined for a new generation of players, Agricola, the award-winning and highly acclaimed game by Uwe Rosenberg, features a revised rulebook and gameplay, along with wood pieces and components for up to four players.The 17th century was not an easy time to be a farmer.  A game for 1-4 players ages 12 and up; play time is 30 minutes per player. Amazing replay value. The Agricola base game is a revised edition of Uwe Rosenberg's celebrated classic. The game features improved all-wood components and a card selection from the base game as well as its expansions, revised and updated for this edition. Players begin the game with two family members and can grow their families over the course of the game. This allows them more actions but remember you have to grow more food to feed your family as it grows! Feeding your family is a special kind of challenge and players will plant grain and vegetables while supplementing their food supply with sheep, wild boar and cattle. Guide your family to wealth, health and prosperity and you will win the game."
230802;Azul;2017;2;4;45;30;45;1,77;75;7,74;7,63;157018;Abstract Games, Family Games;Abstract Strategy, Puzzle, Renaissance;End Game Bonuses, Open Drafting, Pattern Building, Set Collection, Tile Placement, Turn Order: Claim Action;C:\Users\Tomson\Documents\BGG1tool\img\img230802.png;"Introduced by the Moors, azulejos (originally white and blue ceramic tiles) were fully embraced by the Portuguese when their king Manuel I, on a visit to the Alhambra palace in Southern Spain, was mesmerized by the stunning beauty of the Moorish decorative tiles. The king, awestruck by the interior beauty of the Alhambra, immediately ordered that his own palace in Portugal be decorated with similar wall tiles. As a tile-laying artist, you have been challenged to embellish the walls of the Royal Palace of Evora.In the game Azul, players take turns drafting colored tiles from suppliers to their player board. Later in the round, players score points based on how they've placed their tiles to decorate the palace. Extra points are scored for specific patterns and completing sets; wasted supplies harm the player's score. The player with the most points at the end of the game wins."
